Ticket id,Interaction id,Interaction date,Mailbox,Ticket Summary,Interaction content,Innso TYPOLOGY_TICKET ,y1,y2,y3,y4,Unnamed: 11,Unnamed: 12,y,text,intent,tone,resolution,combo_23,combo_234
23035,64488,,support.eu@Company.com,company support issue submit,,In-App Purchase / Unable to make In-App Purchases,In-App Purchase ,Problem/Fault,Payment issue,Payment failed,,,Problem/Fault,company support issue submit,Problem/Fault,Payment issue,Payment failed,Problem/Fault | Payment issue,Problem/Fault | Payment issue | Payment failed
23028,64462,44805.7,support.eu@Company.com,vip privilege,hi about orde konstantinou you sent payment of eur to company se transaction id mw invoice id c f transaction date gmt merchant company se it is about id because of email account had hacked now it has change if you can update my account to vip again will be obliged to you,In-App Purchase / Status of the subscription query,In-App Purchase ,Suggestion,Other,,,,Suggestion,vip privilege hi about orde konstantinou you sent payment of eur to company se transaction id mw invoice id c f transaction date gmt merchant company se it is about id because of email account had hacked now it has change if you can update my account to vip again will be obliged to you,Suggestion,Other,none,Suggestion | Other,Suggestion | Other | none
23028,64471,44805.72847,support.eu@Company.com,vip privilege,ask you to clarify your request so that we can give you the best possible solution am able to understand that payment was made from your account but it is not clear yet to me what is your request towards it for your understanding sincerely madalin company company company se is the provider of company mobile services to company and honor device owners in vip privilege hi about orde konstantinou you sent payment of eur to company se transaction id mw invoice id c f transaction date gmt merchant company se it is about id because of email account had hacked now it has change if you can update my account to vip again will be obliged to you,In-App Purchase / Status of the subscription query,In-App Purchase ,Suggestion,Payment,Query deduction details,,,Suggestion,vip privilege ask you to clarify your request so that we can give you the best possible solution am able to understand that payment was made from your account but it is not clear yet to me what is your request towards it for your understanding sincerely madalin company company company se is the provider of company mobile services to company and honor device owners in vip privilege hi about orde konstantinou you sent payment of eur to company se transaction id mw invoice id c f transaction date gmt merchant company se it is about id because of email account had hacked now it has change if you can update my account to vip again will be obliged to you,Suggestion,Payment,Query deduction details,Suggestion | Payment,Suggestion | Payment | Query deduction details
23028,64477,44805.73611,support.eu@Company.com,vip privilege,sorry for the bad english really trying to explaing to you after attack in my account made hard reset to my company pro and lost the previus account am logging now with another email account to my phone gspace does automatic login according to the phone id no with new id am not vip hope to help you i ask you to clarify your request so that we can give you the best possible solution am able to understand that payment was made from your account but it is not clear yet to me what is your request towards it for your understanding sincerely madalin company company company se is the provider of company mobile services to company and honor device owners in,In-App Purchase / Status of the subscription query,In-App Purchase ,Suggestion,Other,,,,Suggestion,vip privilege sorry for the bad english really trying to explaing to you after attack in my account made hard reset to my company pro and lost the previus account am logging now with another email account to my phone gspace does automatic login according to the phone id no with new id am not vip hope to help you i ask you to clarify your request so that we can give you the best possible solution am able to understand that payment was made from your account but it is not clear yet to me what is your request towards it for your understanding sincerely madalin company company company se is the provider of company mobile services to company and honor device owners in,Suggestion,Other,none,Suggestion | Other,Suggestion | Other | none
23028,64478,44805.73889,support.eu@Company.com,vip privilege,we have received your support request one of our experts will contact you as soon as possible we will contact you via the contact email you provided as soon as we receive updates if you have any further questions please do not hesitate to contact us sincerely madalin company company company se is the provider of company mobile services to company and honor device owners in vip privilege sorry for the bad english really trying to explaing to you after attack in my account made hard reset to my company pro and lost the previus account am logging now with another email account to my phone gspace does automatic login according to the phone id no with new id am not vip hope to help you i ask you to clarify your request so that we can give you the best possible solution am able to understand that payment was made from your account but it is not clear yet to me what is your request towards it for your understanding sincerely madalin company company company se is the provider of company mobile services to company and honor device owners in,In-App Purchase / Status of the subscription query,In-App Purchase ,Suggestion,Other,,,,Suggestion,vip privilege we have received your support request one of our experts will contact you as soon as possible we will contact you via the contact email you provided as soon as we receive updates if you have any further questions please do not hesitate to contact us sincerely madalin company company company se is the provider of company mobile services to company and honor device owners in vip privilege sorry for the bad english really trying to explaing to you after attack in my account made hard reset to my company pro and lost the previus account am logging now with another email account to my phone gspace does automatic login according to the phone id no with new id am not vip hope to help you i ask you to clarify your request so that we can give you the best possible solution am able to understand that payment was made from your account but it is not clear yet to me what is your request towards it for your understanding sincerely madalin company company company se is the provider of company mobile services to company and honor device owners in,Suggestion,Other,none,Suggestion | Other,Suggestion | Other | none
23028,64481,44805.73819,support.eu@Company.com,vip privilege,now my new id is don remember the old tasos koronis sorry for the bad english really trying to explaing to you after attack in my account made hard reset to my company pro and lost the previus account am logging now with another email account to my phone gspace does automatic login according to the phone id no with new id am not vip hope to help you i ask you to clarify your request so that we can give you the best possible solution am able to understand that payment was made from your account but it is not clear yet to me what is your request towards it for your understanding sincerely madalin company company company se is the provider of company mobile services to company and honor device owners in,In-App Purchase / Status of the subscription query,In-App Purchase ,Suggestion,Other,,,,Suggestion,vip privilege now my new id is don remember the old tasos koronis sorry for the bad english really trying to explaing to you after attack in my account made hard reset to my company pro and lost the previus account am logging now with another email account to my phone gspace does automatic login according to the phone id no with new id am not vip hope to help you i ask you to clarify your request so that we can give you the best possible solution am able to understand that payment was made from your account but it is not clear yet to me what is your request towards it for your understanding sincerely madalin company company company se is the provider of company mobile services to company and honor device owners in,Suggestion,Other,none,Suggestion | Other,Suggestion | Other | none
23028,64487,44805.75208,support.eu@Company.com,vip privilege,for support and am very happy to provide you any other information you need for identification we have received your support request one of our experts will contact you as soon as possible we will contact you via the contact email you provided as soon as we receive updates if you have any further questions please do not hesitate to contact us sincerely madalin company company company se is the provider of company mobile services to company and honor device owners in,In-App Purchase / Status of the subscription query,In-App Purchase ,Suggestion,Other,,,,Suggestion,vip privilege for support and am very happy to provide you any other information you need for identification we have received your support request one of our experts will contact you as soon as possible we will contact you via the contact email you provided as soon as we receive updates if you have any further questions please do not hesitate to contact us sincerely madalin company company company se is the provider of company mobile services to company and honor device owners in,Suggestion,Other,none,Suggestion | Other,Suggestion | Other | none
23027,64459,44805.69653,support.de@Company.com,need an invoice,geben sie mir bitte mal eine richtige url an keiner der uns bekannten zug nge id kundencenter cloud weist eine derartige men struktur auf abonennements leer und nirgends sind zahlungen oder rechnungen sichtbar kundencenter wo wir die ger te bestellen unter der company id auch nichts mehr viele gr best regards infotech gmbh informatik service provider www infotech isp net pommernstra holzminden fon fax hrb amtsgericht hildesheim ust id de eori de gesch ftsf hrung disclaimer diese mail und eventuelle anh nge ist ausschlie lich r die adressierte person bestimmt und nnte vertrauliche und oder rechtlich gesch tzte information enthalten wenn sie nicht der richtige adressat sind und oder diese mail irrt mlich erhalten haben informieren sie bitte sofort den absender und vernichten diese mail es ist ihnen in diesem fall auch nicht gestattet diese mail teilweise oder ganz zu lesen zu kopieren an unbefugte weiterzuleiten oder anderweitig r sich selbst zu verwenden widersprechen sie nicht gehen wir davon aus dass sie einverstanden sind dass wir mit ihnen ber das internet per mail korrespondieren unbeschadet dessen ist allein die von uns unterzeichnete schriftliche fassung verbindlich wir weisen darauf hin dass derartige nachrichten mit und ohne zutun von dritten verloren gehen ver ndert oder verf lscht werden nnen auch ist die vertraulichkeit unter umst nden nicht gewahrt wir haften deshalb nicht r die unversehrtheit von mails nachdem sie unseren herrschaftsbereich verlassen haben und nnen ihnen hieraus entstehende sch den nicht ersetzen infotech beh lt sich das recht vor mail kommunikation durch ihre netze zu verfolgen sollte trotz der von uns verwendeten virus schutz programme durch die zusendung von mails ein virus in ihre systeme gelangen haften wir nicht r eventuell hieraus entstehende sch den rechnung brauchen sehr geehrter herrn ich bedanke mich ihnen r ihre geduld in dieses lange prozess und ich entschuldige mich ihnen r den wartenzeit unser internes team sagte mir dass sie ihre rechnung sehen und herunterladen nnen wenn sie dem pfad folgen aber wie auch immer die verf gbarkeit der rechnung sollte jahr sein gehen zu einstellungen kontocenter zahlungen und eink ufe kaufhistorie tippen sie auf die entsprechende bestellung und dann auf rechnung anfordern llen sie alle erforderlichen felder aus best tigen sie die eingegebenen informationen und klicken sie auf in der oberen rechten ecke um ihre anfrage zu senden rgen sie nicht uns anzusprechen falls wir ihnen weiter darin behilflich sein nnen mit freundlichem gru company kundenservice die company se ist eine gesellschaft nach irischem recht mit sitz in company se ist der anbieter von company mobile services r company und honor ger tebesitzer in und anderen ndern rechnung brauchen sehr geehrte damen und herren sie nnen also meiner bitte nach einer rechnung aus dem vormonat nicht nachkommen ein zahlungsf higer einzug ohne rechnungslegung ist nat rlich llig inakzeptabel das gleiche gilt r die haltefrist hier gelten in der eu deutlich ngere aufbewahrungsfristen r belege der leistungserbringung welche ma nahmen haben sie getroffen r den fall dass die berschritten werden company se ist die leistungsfakturiende stelle des produktes company mobile cloud deren vertretung sie hier darstellen sie rfen gern anonym bleiben wenn sie den case lieber auf englisch hren chten habe ich keine probleme damit auf einer rechnung muss ich aber bestehen und wenn es in excel geschrieben wird viele gr best regards infotech gmbh informatik service provider www infotech isp net pommernstra holzminden fon fax hrb amtsgericht hildesheim ust id de eori de gesch ftsf hrung disclaimer diese mail und eventuelle anh nge ist ausschlie lich r die adressierte person bestimmt und nnte vertrauliche und oder rechtlich gesch tzte information enthalten wenn sie nicht der richtige adressat sind und oder diese mail irrt mlich erhalten haben informieren sie bitte sofort den absender und vernichten diese mail es ist ihnen in diesem fall auch nicht gestattet diese mail teilweise oder ganz zu lesen zu kopieren an unbefugte weiterzuleiten oder anderweitig r sich selbst zu verwenden widersprechen sie nicht gehen wir davon aus dass sie einverstanden sind dass wir mit ihnen ber das internet per mail korrespondieren unbeschadet dessen ist allein die von uns unterzeichnete schriftliche fassung verbindlich wir weisen darauf hin dass derartige nachrichten mit und ohne zutun von dritten verloren gehen ver ndert oder verf lscht werden nnen auch ist die vertraulichkeit unter umst nden nicht gewahrt wir haften deshalb nicht r die unversehrtheit von mails nachdem sie unseren herrschaftsbereich verlassen haben und nnen ihnen hieraus entstehende sch den nicht ersetzen infotech beh lt sich das recht vor mail kommunikation durch ihre netze zu verfolgen sollte trotz der von uns verwendeten virus schutz programme durch die zusendung von mails ein virus in ihre systeme gelangen haften wir nicht r eventuell hieraus entstehende sch den rechnung brauchen sehr geehrter herrn vielen dank dass sie sich r company entschieden haben wir hoffen dass es ihnen gut geht ich schreibe ihnen wegen den rechnungen des sie brauchen sie finden diese rechnungen schnell wenn sie gehen zu einstellungen kontocenter zahlungen und eink ufe kaufhistorie tippen sie auf die entsprechende bestellung und dann auf rechnung anfordern llen sie alle erforderlichen felder aus best tigen sie die eingegebenen informationen und klicken sie auf in der oberen rechten ecke um ihre anfrage zu senden sie nnen nur stunden nach der zahlung eine rechnung anfordern company wird innerhalb von stunden eine digitale rechnung ausstellen ich bedanke mich ihnen r ihre verst ndnis und ich nsche ihnen einen sch nen tag weiter rgen sie nicht uns in zukunft anzusprechen falls wir ihnen weiter darin behilflich sein nnen mit freundlichem gru company kundenservice die company se ist eine gesellschaft nach irischem recht mit sitz in company se ist der anbieter von company mobile services r company und honor ger tebesitzer in und anderen ndern company support issue submit product cloud requests view change or cancel subscription contact full name phone numbe contact email address company id account sum of the issue need bill for this subscription german business requirements there is no app namecompany cloud zahlungsmethode company abonniert abonnementnummer ed home news events products partners support copyright company se,In-App Purchase / Invoice request,In-App Purchase ,Suggestion,Invoice,Invoice related request,,,Suggestion,need an invoice geben sie mir bitte mal eine richtige url an keiner der uns bekannten zug nge id kundencenter cloud weist eine derartige men struktur auf abonennements leer und nirgends sind zahlungen oder rechnungen sichtbar kundencenter wo wir die ger te bestellen unter der company id auch nichts mehr viele gr best regards infotech gmbh informatik service provider www infotech isp net pommernstra holzminden fon fax hrb amtsgericht hildesheim ust id de eori de gesch ftsf hrung disclaimer diese mail und eventuelle anh nge ist ausschlie lich r die adressierte person bestimmt und nnte vertrauliche und oder rechtlich gesch tzte information enthalten wenn sie nicht der richtige adressat sind und oder diese mail irrt mlich erhalten haben informieren sie bitte sofort den absender und vernichten diese mail es ist ihnen in diesem fall auch nicht gestattet diese mail teilweise oder ganz zu lesen zu kopieren an unbefugte weiterzuleiten oder anderweitig r sich selbst zu verwenden widersprechen sie nicht gehen wir davon aus dass sie einverstanden sind dass wir mit ihnen ber das internet per mail korrespondieren unbeschadet dessen ist allein die von uns unterzeichnete schriftliche fassung verbindlich wir weisen darauf hin dass derartige nachrichten mit und ohne zutun von dritten verloren gehen ver ndert oder verf lscht werden nnen auch ist die vertraulichkeit unter umst nden nicht gewahrt wir haften deshalb nicht r die unversehrtheit von mails nachdem sie unseren herrschaftsbereich verlassen haben und nnen ihnen hieraus entstehende sch den nicht ersetzen infotech beh lt sich das recht vor mail kommunikation durch ihre netze zu verfolgen sollte trotz der von uns verwendeten virus schutz programme durch die zusendung von mails ein virus in ihre systeme gelangen haften wir nicht r eventuell hieraus entstehende sch den rechnung brauchen sehr geehrter herrn ich bedanke mich ihnen r ihre geduld in dieses lange prozess und ich entschuldige mich ihnen r den wartenzeit unser internes team sagte mir dass sie ihre rechnung sehen und herunterladen nnen wenn sie dem pfad folgen aber wie auch immer die verf gbarkeit der rechnung sollte jahr sein gehen zu einstellungen kontocenter zahlungen und eink ufe kaufhistorie tippen sie auf die entsprechende bestellung und dann auf rechnung anfordern llen sie alle erforderlichen felder aus best tigen sie die eingegebenen informationen und klicken sie auf in der oberen rechten ecke um ihre anfrage zu senden rgen sie nicht uns anzusprechen falls wir ihnen weiter darin behilflich sein nnen mit freundlichem gru company kundenservice die company se ist eine gesellschaft nach irischem recht mit sitz in company se ist der anbieter von company mobile services r company und honor ger tebesitzer in und anderen ndern rechnung brauchen sehr geehrte damen und herren sie nnen also meiner bitte nach einer rechnung aus dem vormonat nicht nachkommen ein zahlungsf higer einzug ohne rechnungslegung ist nat rlich llig inakzeptabel das gleiche gilt r die haltefrist hier gelten in der eu deutlich ngere aufbewahrungsfristen r belege der leistungserbringung welche ma nahmen haben sie getroffen r den fall dass die berschritten werden company se ist die leistungsfakturiende stelle des produktes company mobile cloud deren vertretung sie hier darstellen sie rfen gern anonym bleiben wenn sie den case lieber auf englisch hren chten habe ich keine probleme damit auf einer rechnung muss ich aber bestehen und wenn es in excel geschrieben wird viele gr best regards infotech gmbh informatik service provider www infotech isp net pommernstra holzminden fon fax hrb amtsgericht hildesheim ust id de eori de gesch ftsf hrung disclaimer diese mail und eventuelle anh nge ist ausschlie lich r die adressierte person bestimmt und nnte vertrauliche und oder rechtlich gesch tzte information enthalten wenn sie nicht der richtige adressat sind und oder diese mail irrt mlich erhalten haben informieren sie bitte sofort den absender und vernichten diese mail es ist ihnen in diesem fall auch nicht gestattet diese mail teilweise oder ganz zu lesen zu kopieren an unbefugte weiterzuleiten oder anderweitig r sich selbst zu verwenden widersprechen sie nicht gehen wir davon aus dass sie einverstanden sind dass wir mit ihnen ber das internet per mail korrespondieren unbeschadet dessen ist allein die von uns unterzeichnete schriftliche fassung verbindlich wir weisen darauf hin dass derartige nachrichten mit und ohne zutun von dritten verloren gehen ver ndert oder verf lscht werden nnen auch ist die vertraulichkeit unter umst nden nicht gewahrt wir haften deshalb nicht r die unversehrtheit von mails nachdem sie unseren herrschaftsbereich verlassen haben und nnen ihnen hieraus entstehende sch den nicht ersetzen infotech beh lt sich das recht vor mail kommunikation durch ihre netze zu verfolgen sollte trotz der von uns verwendeten virus schutz programme durch die zusendung von mails ein virus in ihre systeme gelangen haften wir nicht r eventuell hieraus entstehende sch den rechnung brauchen sehr geehrter herrn vielen dank dass sie sich r company entschieden haben wir hoffen dass es ihnen gut geht ich schreibe ihnen wegen den rechnungen des sie brauchen sie finden diese rechnungen schnell wenn sie gehen zu einstellungen kontocenter zahlungen und eink ufe kaufhistorie tippen sie auf die entsprechende bestellung und dann auf rechnung anfordern llen sie alle erforderlichen felder aus best tigen sie die eingegebenen informationen und klicken sie auf in der oberen rechten ecke um ihre anfrage zu senden sie nnen nur stunden nach der zahlung eine rechnung anfordern company wird innerhalb von stunden eine digitale rechnung ausstellen ich bedanke mich ihnen r ihre verst ndnis und ich nsche ihnen einen sch nen tag weiter rgen sie nicht uns in zukunft anzusprechen falls wir ihnen weiter darin behilflich sein nnen mit freundlichem gru company kundenservice die company se ist eine gesellschaft nach irischem recht mit sitz in company se ist der anbieter von company mobile services r company und honor ger tebesitzer in und anderen ndern company support issue submit product cloud requests view change or cancel subscription contact full name phone numbe contact email address company id account sum of the issue need bill for this subscription german business requirements there is no app namecompany cloud zahlungsmethode company abonniert abonnementnummer ed home news events products partners support copyright company se,Suggestion,Invoice,Invoice related request,Suggestion | Invoice,Suggestion | Invoice | Invoice related request
