Ticket id,Interaction id,Interaction date,Mailbox,Ticket Summary,Interaction content,Innso TYPOLOGY_TICKET ,y1,y2,y3,y4,Unnamed: 11,Unnamed: 12,y,text,intent,tone,resolution,combo_23,combo_234
22928,64535,44805.84167,support.de@aspiegel.com,update,for making contact with this email refers to your request regarding the app thanks for the information and for your patience know that this is tense situation and understand your dissatisfaction but am here to offer you the help you need our internal team will analyze this case and offer us solution as soon as possible as soon as we have received the answer from you or one of my colleagues will help you to follow the steps given by our internal team to solve the problem we will do our best to find suitable solution for your request sincerely per per customer service the per se is society under irish law based in loc loc per se is the provider of huawei mobile services for huawei and honor device owners in loc loc loc loc and other countries update good evening per unfortunately my problem has not yet solved hence the required information here huawei id name of the app solitaire screenshot attaches this message that stops does not load and countless restarts do not help since this is paid app of google will not deactivate it and reinstall it for the support sincerely per wrote on st for making contact with this email refers to your request regarding the app so that we can help you as soon as possible please send us the following information your huawei id the name of the app screenshot of the app and the technical problem you have if you have any further questions please feel free to respond to this email thread and we will be happy to help you kind regards per per customer service the per se is society under irish law based in loc loc per se is the provider of huawei mobile services for huawei and honor device owners in loc loc loc loc and other countries,AppGallery &amp; Games / Other Requests,AppGallery &amp; Games ,Problem/Fault,AppGallery-Use,UI Abnormal in Huawei AppGallery,,,Problem/Fault,update for making contact with this email refers to your request regarding the app thanks for the information and for your patience know that this is tense situation and understand your dissatisfaction but am here to offer you the help you need our internal team will analyze this case and offer us solution as soon as possible as soon as we have received the answer from you or one of my colleagues will help you to follow the steps given by our internal team to solve the problem we will do our best to find suitable solution for your request sincerely per per customer service the per se is society under irish law based in loc loc per se is the provider of huawei mobile services for huawei and honor device owners in loc loc loc loc and other countries update good evening per unfortunately my problem has not yet solved hence the required information here huawei id name of the app solitaire screenshot attaches this message that stops does not load and countless restarts do not help since this is paid app of google will not deactivate it and reinstall it for the support sincerely per wrote on st for making contact with this email refers to your request regarding the app so that we can help you as soon as possible please send us the following information your huawei id the name of the app screenshot of the app and the technical problem you have if you have any further questions please feel free to respond to this email thread and we will be happy to help you kind regards per per customer service the per se is society under irish law based in loc loc per se is the provider of huawei mobile services for huawei and honor device owners in loc loc loc loc and other countries,Problem/Fault,AppGallery-Use,UI Abnormal in Huawei AppGallery,Problem/Fault | AppGallery-Use,Problem/Fault | AppGallery-Use | UI Abnormal in Huawei AppGallery
22926,64180,44805.35556,support.es1@aspiegel.com,pinters huawei,thanks for contacting aspiegel we hope you do well this email refers to your concern about huawei points step please verify if you have pressed the accept button during the payment process which means that you accept to receive cashback in huawei points these were the steps you had to continue to accept to receive the return of huawei points after selecting the item you want to buy select payment method the payment methods that will reward the user with cashback will have an orange phrase that mentions reward in points when your payment has been completed and has been successful touch accept to accept your participation in the campaign after accepting click on made to accept the campaign cashback you can find your huawei points after following steps to in the phone settings huawei points huawei claim their points should be in the claimed tab step if you have pressed the accept button send us the following data your country of service the date on which you made the purchase send us the following screenshots of the points page screenshot of the unresated points screenshot of the claimed points and screenshot of the expired points note to find these pages go to telephone settings huawei points huawei claim indicate the name of the campaign in which he participated indicate how many points huawei should receive if you have any other questions do not hesitate to answer this email thread and we will be happy to clarify your doubts sincerely per to the client aspiegelaspiegel is the huawei mobile services provider to the owners of huawei and honor devices in loc loc loc loc and other countries huawei points good afternoon have made purchase as in recent days checking that the promotion of of huawei points continues but it has not given me the option to obtain them nor do they appear to claim them attaching purchase thanks and greeting,AppGallery &amp; Games / Huawei points missing,AppGallery &amp; Games ,Problem/Fault,Coupon/Gifts/Points Issues,Can't use or acquire,,,Problem/Fault,pinters huawei thanks for contacting aspiegel we hope you do well this email refers to your concern about huawei points step please verify if you have pressed the accept button during the payment process which means that you accept to receive cashback in huawei points these were the steps you had to continue to accept to receive the return of huawei points after selecting the item you want to buy select payment method the payment methods that will reward the user with cashback will have an orange phrase that mentions reward in points when your payment has been completed and has been successful touch accept to accept your participation in the campaign after accepting click on made to accept the campaign cashback you can find your huawei points after following steps to in the phone settings huawei points huawei claim their points should be in the claimed tab step if you have pressed the accept button send us the following data your country of service the date on which you made the purchase send us the following screenshots of the points page screenshot of the unresated points screenshot of the claimed points and screenshot of the expired points note to find these pages go to telephone settings huawei points huawei claim indicate the name of the campaign in which he participated indicate how many points huawei should receive if you have any other questions do not hesitate to answer this email thread and we will be happy to clarify your doubts sincerely per to the client aspiegelaspiegel is the huawei mobile services provider to the owners of huawei and honor devices in loc loc loc loc and other countries huawei points good afternoon have made purchase as in recent days checking that the promotion of of huawei points continues but it has not given me the option to obtain them nor do they appear to claim them attaching purchase thanks and greeting,Problem/Fault,Coupon/Gifts/Points Issues,Can't use or acquire,Problem/Fault | Coupon/Gifts/Points Issues,Problem/Fault | Coupon/Gifts/Points Issues | Can't use or acquire
22926,64224,44805.40208,support.es1@aspiegel.com,huawei puntos,the problem was just that in my previous purchases always appeared the obtain points button and this time only what can be seen in the attached image was given no option to accept and get but to get to that step the purchase was already made thought that entering the application could obtain the unresated points but they do not appear see also next attached image in which include the last points obtained and the absence in this purchase thanks pd if necessary by ease you can contact me greeting per jue wrote client thanks for contacting per we hope you do well this email refers to your concern about huawei points step please verify if you have pressed the accept button during the payment process which means that you accept to receive cashback in huawei points these were the steps you had to continue to accept to receive the return of huawei points after selecting the item you want to buy select payment method the payment methods that will reward the user with cashback will have an orange phrase that mentions reward in points when your payment has been completed and has been successful touch accept to accept your participation in the campaign after accepting click on made to accept the campaign cashback you can find your huawei points after following steps to in the phone settings huawei points huawei claim their points should be in the claimed tab step if you have pressed the accept button send us the following data your country of service the date on which you made the purchase send us the following screenshots of the points page screenshot of the unresated points screenshot of the claimed points and screenshot of the expired points note to find these pages go to telephone settings huawei points huawei claim indicate the name of the campaign in which he participated indicate how many points huawei should receive if you have any other questions do not hesitate to answer this email thread and we will be happy to clarify your doubts sincerely ram per customer service support per is society constituted by virtue of the legislation of loc with its headquarters in loc loc per is the provider of mobile services of huawei to the owners of huawei and honor devices in loc loc loc loc and other countries,AppGallery &amp; Games / Huawei points missing,AppGallery &amp; Games ,Problem/Fault,Coupon/Gifts/Points Issues,Can't use or acquire,,,Problem/Fault,huawei puntos the problem was just that in my previous purchases always appeared the obtain points button and this time only what can be seen in the attached image was given no option to accept and get but to get to that step the purchase was already made thought that entering the application could obtain the unresated points but they do not appear see also next attached image in which include the last points obtained and the absence in this purchase thanks pd if necessary by ease you can contact me greeting per jue wrote client thanks for contacting per we hope you do well this email refers to your concern about huawei points step please verify if you have pressed the accept button during the payment process which means that you accept to receive cashback in huawei points these were the steps you had to continue to accept to receive the return of huawei points after selecting the item you want to buy select payment method the payment methods that will reward the user with cashback will have an orange phrase that mentions reward in points when your payment has been completed and has been successful touch accept to accept your participation in the campaign after accepting click on made to accept the campaign cashback you can find your huawei points after following steps to in the phone settings huawei points huawei claim their points should be in the claimed tab step if you have pressed the accept button send us the following data your country of service the date on which you made the purchase send us the following screenshots of the points page screenshot of the unresated points screenshot of the claimed points and screenshot of the expired points note to find these pages go to telephone settings huawei points huawei claim indicate the name of the campaign in which he participated indicate how many points huawei should receive if you have any other questions do not hesitate to answer this email thread and we will be happy to clarify your doubts sincerely ram per customer service support per is society constituted by virtue of the legislation of loc with its headquarters in loc loc per is the provider of mobile services of huawei to the owners of huawei and honor devices in loc loc loc loc and other countries,Problem/Fault,Coupon/Gifts/Points Issues,Can't use or acquire,Problem/Fault | Coupon/Gifts/Points Issues,Problem/Fault | Coupon/Gifts/Points Issues | Can't use or acquire
22926,64238,44805.42569,support.es1@aspiegel.com,pinters huawei,thanks for contacting aspiegel we hope you do well this email refers to your concern about huawei points we for having sent the screenshots requested to be able to help you with your problem send us the following data your country of service the date on which he made the purchase indicate the name of the campaign in which he participated indicate how many points huawei should receive if you have any other questions do not hesitate to answer this email thread and we will be happy to clarify your doubts sincerely per to the client aspiegelaspiegel is the huawei mobile services provider to the owners of huawei and honor devices in loc loc loc loc and other countries huawei points the problem was just that in my previous purchases always appeared the obtain points button and this time only what can be seen in the attached image was given no option to accept and get but to get to that step the purchase was already made thought that entering the application could obtain the unresated points but they do not appear see also next attached image in which include the last points obtained and the absence in this purchase thanks pd if necessary by ease you can contact me greeting per jue wrote client thanks for contacting aspiegel we hope you do well this email refers to your concern about huawei points step please verify if you have pressed the accept button during the payment process which means that you accept to receive cashback in huawei points these were the steps you had to continue to accept to receive the return of huawei points after selecting the item you want to buy select payment method the payment methods that will reward the user with cashback will have an orange phrase that mentions reward in points when your payment has been completed and has been successful touch accept to accept your participation in the campaign after accepting click on made to accept the campaign cashback you can find your huawei points after following steps to in the phone settings huawei points huawei claim their points should be in the claimed tab step if you have pressed the accept button send us the following data your country of service the date on which you made the purchase send us the following screenshots of the points page screenshot of the unresated points screenshot of the claimed points and screenshot of the expired points note to find these pages go to telephone settings huawei points huawei claim indicate the name of the campaign in which he participated indicate how many points huawei should receive if you have any other questions do not hesitate to answer this email thread and we will be happy to clarify your doubts sincerely per to the client aspiegelaspiegel is the huawei mobile services provider to the owners of huawei and honor devices in loc loc loc loc and other countries,AppGallery &amp; Games / Huawei points missing,AppGallery &amp; Games ,Problem/Fault,Coupon/Gifts/Points Issues,Can't use or acquire,,,Problem/Fault,pinters huawei thanks for contacting aspiegel we hope you do well this email refers to your concern about huawei points we for having sent the screenshots requested to be able to help you with your problem send us the following data your country of service the date on which he made the purchase indicate the name of the campaign in which he participated indicate how many points huawei should receive if you have any other questions do not hesitate to answer this email thread and we will be happy to clarify your doubts sincerely per to the client aspiegelaspiegel is the huawei mobile services provider to the owners of huawei and honor devices in loc loc loc loc and other countries huawei points the problem was just that in my previous purchases always appeared the obtain points button and this time only what can be seen in the attached image was given no option to accept and get but to get to that step the purchase was already made thought that entering the application could obtain the unresated points but they do not appear see also next attached image in which include the last points obtained and the absence in this purchase thanks pd if necessary by ease you can contact me greeting per jue wrote client thanks for contacting aspiegel we hope you do well this email refers to your concern about huawei points step please verify if you have pressed the accept button during the payment process which means that you accept to receive cashback in huawei points these were the steps you had to continue to accept to receive the return of huawei points after selecting the item you want to buy select payment method the payment methods that will reward the user with cashback will have an orange phrase that mentions reward in points when your payment has been completed and has been successful touch accept to accept your participation in the campaign after accepting click on made to accept the campaign cashback you can find your huawei points after following steps to in the phone settings huawei points huawei claim their points should be in the claimed tab step if you have pressed the accept button send us the following data your country of service the date on which you made the purchase send us the following screenshots of the points page screenshot of the unresated points screenshot of the claimed points and screenshot of the expired points note to find these pages go to telephone settings huawei points huawei claim indicate the name of the campaign in which he participated indicate how many points huawei should receive if you have any other questions do not hesitate to answer this email thread and we will be happy to clarify your doubts sincerely per to the client aspiegelaspiegel is the huawei mobile services provider to the owners of huawei and honor devices in loc loc loc loc and other countries,Problem/Fault,Coupon/Gifts/Points Issues,Can't use or acquire,Problem/Fault | Coupon/Gifts/Points Issues,Problem/Fault | Coupon/Gifts/Points Issues | Can't use or acquire
22926,64320,44805.53333,support.es1@aspiegel.com,huawei puntos,good afternoon answer the questions requested loc deputy image in purchases attached image of if have calculated well thanks and greeting per jue wrote client thanks for contacting aspiegel we hope you do well this email refers to your concern about huawei points we for having sent the screenshots requested to be able to help you with your problem send us the following data your country of service the date on which he made the purchase indicate the name of the campaign in which he participated indicate how many points huawei should receive if you have any other questions do not hesitate to answer this email thread and we will be happy to clarify your doubts sincerely per to the client aspiegelaspiegel is the huawei mobile services provider to the owners of huawei and honor devices in loc loc loc loc and other countries,AppGallery &amp; Games / Huawei points missing,AppGallery &amp; Games ,Problem/Fault,Coupon/Gifts/Points Issues,Can't use or acquire,,,Problem/Fault,huawei puntos good afternoon answer the questions requested loc deputy image in purchases attached image of if have calculated well thanks and greeting per jue wrote client thanks for contacting aspiegel we hope you do well this email refers to your concern about huawei points we for having sent the screenshots requested to be able to help you with your problem send us the following data your country of service the date on which he made the purchase indicate the name of the campaign in which he participated indicate how many points huawei should receive if you have any other questions do not hesitate to answer this email thread and we will be happy to clarify your doubts sincerely per to the client aspiegelaspiegel is the huawei mobile services provider to the owners of huawei and honor devices in loc loc loc loc and other countries,Problem/Fault,Coupon/Gifts/Points Issues,Can't use or acquire,Problem/Fault | Coupon/Gifts/Points Issues,Problem/Fault | Coupon/Gifts/Points Issues | Can't use or acquire
22926,64322,44805.53611,support.es1@aspiegel.com,pinters huawei,for the information provided we inform you that your application is being prosecuted by our specialized department as soon as we have an update we will let it know for more questions do not hesitate to answer this thread of email and we will be happy to clarify your doubts sincerely per to the client aspiegelaspiegel is the huawei mobile services provider to the owners of huawei and honor devices in loc loc loc loc and other countries huawei points good afternoon answer the questions requested loc attached image in purchases attached image of if have calculated well thanks and greeting per jue wrote client thanks for contacting aspiegel we hope you do well this email refers to your concern about huawei points we for having sent the screenshots requested to be able to help you with your problem send us the following data your country of service the date on which he made the purchase indicate the name of the campaign in which he participated indicate how many points huawei should receive if you have any other questions do not hesitate to answer this email thread and we will be happy to clarify your doubts sincerely per to the client aspiegelaspiegel is the huawei mobile services provider to the owners of huawei and honor devices in loc loc loc loc and other countries,AppGallery &amp; Games / Huawei points missing,AppGallery &amp; Games ,Problem/Fault,Coupon/Gifts/Points Issues,Can't use or acquire,,,Problem/Fault,pinters huawei for the information provided we inform you that your application is being prosecuted by our specialized department as soon as we have an update we will let it know for more questions do not hesitate to answer this thread of email and we will be happy to clarify your doubts sincerely per to the client aspiegelaspiegel is the huawei mobile services provider to the owners of huawei and honor devices in loc loc loc loc and other countries huawei points good afternoon answer the questions requested loc attached image in purchases attached image of if have calculated well thanks and greeting per jue wrote client thanks for contacting aspiegel we hope you do well this email refers to your concern about huawei points we for having sent the screenshots requested to be able to help you with your problem send us the following data your country of service the date on which he made the purchase indicate the name of the campaign in which he participated indicate how many points huawei should receive if you have any other questions do not hesitate to answer this email thread and we will be happy to clarify your doubts sincerely per to the client aspiegelaspiegel is the huawei mobile services provider to the owners of huawei and honor devices in loc loc loc loc and other countries,Problem/Fault,Coupon/Gifts/Points Issues,Can't use or acquire,Problem/Fault | Coupon/Gifts/Points Issues,Problem/Fault | Coupon/Gifts/Points Issues | Can't use or acquire
22924,64153,44805.31736,support.eu@aspiegel.com,refund request,screenshot com huawei hwid jpg svid mp we hope you re doing well will do my very best to assist you this email is regarding your refund request in order to give you the best solution please provide us with the following information screenshot or record video of the charge your huawei id app gallery hms core open then take screenshot if you have any further questions please feel free to reply to this email thread and we will be happy to walk you through your doubts sincerely alexandru refund request the game is allowing illegal third party transactions and it not fair for players purchasing through legal and legit platforms to recharge so demand at least partial refund from the app kingdom guard,AppGallery &amp; Games / Refund request: accidental purchase  ( item),AppGallery &amp; Games ,Problem/Fault,Third Party APPs,Refund,,,Problem/Fault,refund request screenshot com huawei hwid jpg svid mp we hope you re doing well will do my very best to assist you this email is regarding your refund request in order to give you the best solution please provide us with the following information screenshot or record video of the charge your huawei id app gallery hms core open then take screenshot if you have any further questions please feel free to reply to this email thread and we will be happy to walk you through your doubts sincerely alexandru refund request the game is allowing illegal third party transactions and it not fair for players purchasing through legal and legit platforms to recharge so demand at least partial refund from the app kingdom guard,Problem/Fault,Third Party APPs,Refund,Problem/Fault | Third Party APPs,Problem/Fault | Third Party APPs | Refund
